{
  "$schema": "http://json-schema.org/draft-07/schema#",
  "title": "Local student profile",
  "type": "object",
  "additionalProperties": false,
  "properties": {
    "id": {
      "type": "string",
      "minLength": 1,
      "maxLength": 100,
      "pattern": "^[a-zA-Z0-9][a-zA-Z0-9_.-]*$"
    },
    "name": {
      "type": "string",
      "minLength": 1,
      "maxLength": 10000,
      "pattern": "\\S"
    },
    "grade": {
      "type": "string",
      "minLength": 1,
      "maxLength": 10000,
      "pattern": "\\S"
    },
    "preferredLanguage": {
      "type": "string",
      "pattern": "^[a-z]{2}(?:-[A-Z]{2})?$"
    },
    "subjects": {
      "type": "array",
      "minItems": 1,
      "maxItems": 100,
      "items": {
        "type": "string",
        "minLength": 1,
        "maxLength": 100,
        "pattern": "^[a-zA-Z0-9][a-zA-Z0-9_.-]*$"
      },
      "uniqueItems": true
    },
    "createdAt": {
      "type": "string",
      "pattern": "^\\d{4}-\\d{2}-\\d{2}T\\d{2}:\\d{2}:\\d{2}(?:\\.\\d{1,3})?Z$"
    },
    "updatedAt": {
      "type": "string",
      "pattern": "^\\d{4}-\\d{2}-\\d{2}T\\d{2}:\\d{2}:\\d{2}(?:\\.\\d{1,3})?Z$"
    },
    "archived": {
      "type": "boolean"
    }
  },
  "required": ["id", "name", "grade", "preferredLanguage", "subjects"]
}
